{
  "contract_type": "factory.v2.distribution_handoff",
  "contract_version": "1.0.0",
  "handoff": {
    "handoff_id": "distribution-demo",
    "created_at": "2026-09-14T05:00:00Z"
  },
  "mission_id": "mission.demo",
  "approved_rc": {
    "rc_id": "rc.demo",
    "candidate_id": "candidate-b",
    "source_revision": "2222222222222222222222222222222222222222",
    "artifact_hash": "sha256:cccccccccccccccccccccccccccccccccccccccccccccccccccccccccccccccc"
  },
  "deployment_artifact": {
    "artifact_uri": "registry://factory-v2/releases/1.0.0",
    "candidate_id": "candidate-b",
    "source_revision": "2222222222222222222222222222222222222222",
    "artifact_hash": "sha256:cccccccccccccccccccccccccccccccccccccccccccccccccccccccccccccccc",
    "immutable": true
  },
  "owner_approval": {
    "decision": "APPROVE",
    "rc_id": "rc.demo",
    "candidate_id": "candidate-b",
    "approved_at": "2026-09-14T05:05:00Z",
    "evidence": {
      "kind": "owner-approval",
      "uri": "vault://evidence/distribution-owner-approval.json",
      "revision": "2222222222222222222222222222222222222222",
      "content_hash": "sha256:dddddddddddddddddddddddddddddddddddddddddddddddddddddddddddddddd",
      "immutable": true
    }
  },
  "release": {
    "release_id": "release-demo",
    "version": "1.0.0",
    "created_at": "2026-09-14T05:06:00Z"
  },
  "deployment": {
    "environment": "staging",
    "target": "factory-v2-demo",
    "parameters": {},
    "secret_values_present": false
  },
  "rollback": {
    "required": true,
    "recovery_identity": {
      "rc_id": "rc.demo",
      "artifact_hash": "sha256:cccccccccccccccccccccccccccccccccccccccccccccccccccccccccccccccc"
    },
    "evidence_refs": [
      {
        "kind": "rollback-plan",
        "uri": "vault://evidence/rollback-demo.json",
        "revision": "2222222222222222222222222222222222222222",
        "content_hash": "sha256:eeeeeeeeeeeeeeeeeeeeeeeeeeeeeeeeeeeeeeeeeeeeeeeeeeeeeeeeeeeeeeee",
        "immutable": true
      }
    ]
  }
}
